"directory","producer","status","should_remain","recommendation"
"results/cross_analysis","Aging diagnostics via getResultsDir('cross_analysis', ...)","historical namespace already migrated into runs/run_legacy_cross_analysis","temporarily yes","keep as legacy namespace until future consolidation with cross_experiment"
"results/phaseC","Aging pipeline runPhaseC_leaveOneOut.m and related Phase C outputs","historical namespace already migrated into runs/run_legacy_phaseC","temporarily yes","leave in place; later decide whether to fold into aging or cross_experiment"
"results/legacy_root","historical loose files formerly written directly under results/","cleanup holding namespace with run_legacy_results_root","yes for provenance","no automatic move needed"
"results/repository_audit","repository audit and compliance follow-up work","mixed: canonical runs plus flat reports/zips","yes","prefer future audit outputs in repository_audit/runs and keep flat docs only when intentionally top-level"
"results/repository_cleanup","repository cleanup migration summary","flat historical report only","probably not as an active namespace","candidate for later migration into repository_audit/runs/run_legacy_repository_cleanup or archival under repository_audit"
"results/cross_experiment","intended canonical namespace for cross-experiment analyses","canonical run namespace","yes","no change"
"results/aging","canonical experiment namespace","canonical run namespace","yes","no change"
"results/relaxation","canonical experiment namespace","canonical run namespace","yes","no change"
"results/switching","canonical experiment namespace","canonical run namespace","yes","no change"
