scalar,recommended_role,paper_location,allowed_wording,forbidden_wording,evidence_basis
A_obs,Primary direct relaxation amplitude (experimentally transparent),Main text,"Report as the primary measured relaxation amplitude consistent with RCON definitions; interpret physically without invoking rank-1 optimality.","Claim rank-1 reconstruction optimality; claim equality to legacy A_T or m0_svd without lineage proof.","AR01 RECOMMENDED_MAIN_TEXT_SCALAR; AR02 RECOMMENDED_MAIN_TEXT_SCALAR_AFTER_02; AR01 held-out RMSE worse than m0/m0_LOO tracks."
m0_LOO_SVD_projection,Best non-leaky rank-1 reconstruction coordinate on the RF3R2 map; LOO-SVD projection coefficients,Supplement / methods figure,"Describe as the LOO-SVD projection coefficient track that minimizes held-out curve RMSE among tested non-leaky scalars on the shared M(t,T); robust across LOO folds (AR02) and tested map variants (AR03).","Assert unique physical material amplitude; equate automatically to RCON m0_svd column without sign/scale caveats; omit that AR01 used full-column m0_svd not LOO coefficients.","AR02 M0_LOO_HELDOUT_RECONSTRUCTION_BEST YES; AR03 M0_LOO_ALWAYS_BEST YES; AR03 SCALAR_RANKING_STABLE_ACROSS_VARIANTS YES."
m0_svd (RCON SVD_score_mode1),Full-map rank-1 amplitude reference; in-sample optimal rank-1 coefficient tied to same psi as M; leaky when paired with full-map psi in held-out tests,Supplement / diagnostic,"Use as RCON reference column; acknowledge rank-1 in-sample optimality when psi matches full SVD (AR01); separate from m0_LOO coefficient track.","Present as identical to m0_LOO without defining LOO vs full; use as LOO-held-out winner label (that role is m0_LOO).","AR01 BEST_IN_SAMPLE_RECONSTRUCTION_SCALAR m0_svd; AR02 FULL_DATA_M0 marked leaky for held-out reconstruction column."
A_proj_nonSVD,Best non-SVD compromise scalar on common map,Supplement,"Best compromise among fixed non-SVD columns on M; often second after m0_LOO in rankings.","Claim equivalence to A_obs or m0 without qualification.","AR01 BEST_HELDOUT_NON_M0_SCALAR; AR02 BEST_COMPROMISE_SCALAR_AFTER_ROBUSTNESS; AR03 times_top2 counts."
projection_mean_curve,Optional supplementary template projection reference,Supplement only,"Secondary proxy aligned with RF5A-style projection audits; near-tied numerically with A_proj/m0 on strict set in AR01/02.","Primary observable or unique reconstruction winner.","AR01 tables; AR02 summary ties."
A_T_old (legacy temperature_observables / historical rank-1 amplitude),Legacy diagnostic until lineage reconciliation completes,Appendix / lineage note only,"Conceptually in the same rank-1/SVD amplitude family as modern m0 tracks; identity to current m0_svd is an explicit open reconciliation task.","State numerical equality to m0_svd or m0_LOO without RLX-LINEAGE-05 evidence; fold into main-text amplitude without caveat.","AR01 LEGACY_AT_AVAILABLE NO (table join); task RLX-ACTIVITY-LINEAGE-05 scoped in consolidation."
