"type","path","description","method_type"
"report","Aging old/docs/switching_model.md","Report artifact: switching model","decomposition"
"report","Aging/ARCHITECTURE.md","Report artifact: ARCHITECTURE","unknown"
"report","Aging/CANONICAL_IMPLEMENTATION_SUMMARY.md","Report artifact: CANONICAL IMPLEMENTATION SUMMARY","unknown"
"report","Aging/DEBUG_INFRASTRUCTURE_GUIDE.md","Report artifact: DEBUG INFRASTRUCTURE GUIDE","unknown"
"report","Aging/DELIVERY_SUMMARY.md","Report artifact: DELIVERY SUMMARY","unknown"
"report","Aging/DEPLOYMENT_CHECKLIST.md","Report artifact: DEPLOYMENT CHECKLIST","unknown"
"report","Aging/DEPLOYMENT_COMPLETE.md","Report artifact: DEPLOYMENT COMPLETE","unknown"
"report","Aging/docs/CANONICAL_TWO_TIME_DEFINITION.md","Report artifact: CANONICAL TWO TIME DEFINITION","unknown"
"report","Aging/docs/stage4_refactor_side_by_side.md","Report artifact: stage4 refactor side by side","unknown"
"report","Aging/docs/stage4_refactor_verification.md","Report artifact: stage4 refactor verification","unknown"
"report","Aging/docs/state_flow.md","Report artifact: state flow","unknown"
"report","Aging/docs/VERIFICATION_SUMMARY.md","Report artifact: VERIFICATION SUMMARY","unknown"
"report","Aging/ENHANCED_DIAGNOSTICS_SUMMARY.md","Report artifact: ENHANCED DIAGNOSTICS SUMMARY","unknown"
"report","Aging/IMPLEMENTATION_SUMMARY.md","Report artifact: IMPLEMENTATION SUMMARY","unknown"
"report","Aging/INDEX.md","Report artifact: INDEX","unknown"
"report","Aging/MANIFEST.md","Report artifact: MANIFEST","unknown"
"report","Aging/PHYSICS_CONTEXT_ARCHITECTURE.md","Report artifact: PHYSICS CONTEXT ARCHITECTURE","unknown"
"report","Aging/PHYSICS_DIAGNOSTICS_GUIDE.md","Report artifact: PHYSICS DIAGNOSTICS GUIDE","unknown"
"report","Aging/QUICK_REFERENCE.md","Report artifact: QUICK REFERENCE","unknown"
"report","Aging/QUICK_START.md","Report artifact: QUICK START","unknown"
"report","Aging/README.md","Report artifact: README","unknown"
"report","Aging/README_DEBUG_SYSTEM.md","Report artifact: README DEBUG SYSTEM","unknown"
"report","Aging/REAL_DATA_SETUP_GUIDE.md","Report artifact: REAL DATA SETUP GUIDE","unknown"
"report","Aging/ROBUST_BASELINE_IMPLEMENTATION_SUMMARY.md","Report artifact: ROBUST BASELINE IMPLEMENTATION SUMMARY","background_model"
"report","Aging/STATUS.md","Report artifact: STATUS","unknown"
"report","Aging/verification/VERIFICATION_REPORT.md","Report artifact: VERIFICATION REPORT","unknown"
"report","archive/invalid/reports/aging_alpha_closure_report.md","Report artifact: aging alpha closure report","unknown"
"report","archive/invalid/reports/aging_hermetic_closure_report.md","Report artifact: aging hermetic closure report","unknown"
"report","archive/invalid/reports/aging_kappa_comparison.md","Report artifact: aging kappa comparison","unknown"
"report","archive/invalid/reports/aging_kappa1_prediction.md","Report artifact: aging kappa1 prediction","unknown"
"report","archive/invalid/reports/aging_kappa2_report.md","Report artifact: aging kappa2 report","unknown"
"report","archive/invalid/reports/aging_measurement_definition_audit.md","Report artifact: aging measurement definition audit","unknown"
"report","archive/invalid/reports/aging_meta_audit_latest_results.md","Report artifact: aging meta audit latest results","unknown"
"report","archive/invalid/reports/aging_meta_audit_verdict_summary.md","Report artifact: aging meta audit verdict summary","unknown"
"report","archive/invalid/reports/aging_prediction_report.md","Report artifact: aging prediction report","unknown"
"report","archive/invalid/reports/aging_relaxation_confusion_audit.md","Report artifact: aging relaxation confusion audit","unknown"
"report","archive/stale/reports/alpha_observable_search.md","Report artifact: alpha observable search","unknown"
"report","docs/reports/legacy/AGING_AUDIT_REPORT.md","Report artifact: AGING AUDIT REPORT","unknown"
"report","docs/reports/legacy/AGING_STABILIZATION_COMPLETE.md","Report artifact: AGING STABILIZATION COMPLETE","unknown"
"report","docs/reports/legacy/AGING_VERIFICATION_FINAL.md","Report artifact: AGING VERIFICATION FINAL","unknown"
"report","junk/aging_trace_structure_attempt/AGING_STRUCTURE_EXECUTION_HANDOFF.md","Report artifact: AGING STRUCTURE EXECUTION HANDOFF","unknown"
"report","junk/aging_trace_structure_attempt/AGING_TRACE_STRUCTURE_DELIVERY_SUMMARY.md","Report artifact: AGING TRACE STRUCTURE DELIVERY SUMMARY","unknown"
"report","junk/aging_trace_structure_attempt/FINAL_COMPLETION_REPORT.md","Report artifact: FINAL COMPLETION REPORT","unknown"
"report","junk/aging_trace_structure_attempt/MASTER_EXECUTIVE_SUMMARY.md","Report artifact: MASTER EXECUTIVE SUMMARY","unknown"
"report","junk/aging_trace_structure_attempt/PRODUCTION_DEPLOYMENT_CHECKLIST.md","Report artifact: PRODUCTION DEPLOYMENT CHECKLIST","unknown"
"report","junk/aging_trace_structure_attempt/PRODUCTION_SIGN_OFF_CERTIFICATE.md","Report artifact: PRODUCTION SIGN OFF CERTIFICATE","unknown"
"report","junk/aging_trace_structure_attempt/REPOSITORY_STATE_SUMMARY.md","Report artifact: REPOSITORY STATE SUMMARY","unknown"
"report","junk/aging_trace_structure_attempt/SESSION_SUMMARY_2026_03_30.md","Report artifact: SESSION SUMMARY 2026 03 30","unknown"
"report","junk/aging_trace_structure_attempt/WORK_COMPLETION_AND_HANDOFF.md","Report artifact: WORK COMPLETION AND HANDOFF","unknown"
"report","reports/aging_kappa1_kappa2_collapse.md","Report artifact: aging kappa1 kappa2 collapse","dip_extraction"
"report","reports/alpha_decomposition_report.md","Report artifact: alpha decomposition report","decomposition"
"report","reports/alpha_from_PT_report.md","Report artifact: alpha from PT report","unknown"
"report","reports/alpha_physical_validity.md","Report artifact: alpha physical validity","unknown"
"report","reports/alpha_res_cross_experiment_report.md","Report artifact: alpha res cross experiment report","unknown"
"report","reports/alpha_res_origin_report.md","Report artifact: alpha res origin report","unknown"
"report","reports/alpha_res_physics_report.md","Report artifact: alpha res physics report","unknown"
"report","reports/alpha_res_smoothed_report.md","Report artifact: alpha res smoothed report","unknown"
"report","reports/alpha_res_state_report.md","Report artifact: alpha res state report","unknown"
"report","reports/alpha_res_trajectory_report.md","Report artifact: alpha res trajectory report","unknown"
"report","reports/alpha_res_transition_report.md","Report artifact: alpha res transition report","unknown"
"report","reports/alpha_structure_report.md","Report artifact: alpha structure report","unknown"
"report","reports/alpha_with_kappa1_report.md","Report artifact: alpha with kappa1 report","unknown"
"report","reports/kappa1_from_PT_aligned_report.md","Report artifact: kappa1 from PT aligned report","unknown"
"report","reports/kappa1_from_PT_report.md","Report artifact: kappa1 from PT report","unknown"
"report","reports/kappa1_projection_test.md","Report artifact: kappa1 projection test","fitting"
"report","reports/kappa1_speak_equivalence_report.md","Report artifact: kappa1 speak equivalence report","unknown"
"report","reports/kappa1_speak_ratio_test.md","Report artifact: kappa1 speak ratio test","unknown"
"report","reports/kappa2_kww_shape_test.md","Report artifact: kappa2 kww shape test","fitting"
"report","reports/kappa2_opening_test.md","Report artifact: kappa2 opening test","unknown"
"report","reports/kappa2_operational_signature.md","Report artifact: kappa2 operational signature","unknown"
"report","reports/kappa2_phenomenological_audit.md","Report artifact: kappa2 phenomenological audit","unknown"
"report","reports/kappa2_physical_necessity.md","Report artifact: kappa2 physical necessity","unknown"
"report","reports/kappa2_state_geometry_report.md","Report artifact: kappa2 state geometry report","unknown"
"report","reports/phi_kappa_canonical_verdict.md","Report artifact: phi kappa canonical verdict","unknown"
"report","reports/PT_kappa_relaxation_mapping.md","Report artifact: PT kappa relaxation mapping","unknown"
"report","reports/PT_to_relaxation_mapping.md","Report artifact: PT to relaxation mapping","unknown"
"report","reports/relaxation_canonical_definition.md","Report artifact: relaxation canonical definition","unknown"
"report","reports/relaxation_canonical_implementation_check.md","Report artifact: relaxation canonical implementation check","unknown"
"report","reports/relaxation_dataset_validation.md","Report artifact: relaxation dataset validation","unknown"
"report","reports/relaxation_deep_search.md","Report artifact: relaxation deep search","unknown"
"report","reports/relaxation_extraction.md","Report artifact: relaxation extraction","unknown"
"report","reports/relaxation_full_dataset.md","Report artifact: relaxation full dataset","unknown"
"report","reports/relaxation_measurement_canonical_self_audit.md","Report artifact: relaxation measurement canonical self audit","unknown"
"report","reports/relaxation_measurement_canonical_self_audit_v2.md","Report artifact: relaxation measurement canonical self audit v2","unknown"
"report","reports/relaxation_measurement_focused_t0_norm_window.md","Report artifact: relaxation measurement focused t0 norm window","slope"
"report","reports/relaxation_measurement_robustness_audit.md","Report artifact: relaxation measurement robustness audit","unknown"
"report","reports/relaxation_outlier_audit.md","Report artifact: relaxation outlier audit","unknown"
"report","reports/relaxation_outlier_audit_no_toolbox.md","Report artifact: relaxation outlier audit no toolbox","unknown"
"report","reports/relaxation_pipeline_audit.md","Report artifact: relaxation pipeline audit","unknown"
"report","reports/relaxation_raw_candidates.md","Report artifact: relaxation raw candidates","unknown"
"report","reports/relaxation_structure_scan.md","Report artifact: relaxation structure scan","unknown"
"report","reports/relaxation_time_series_scan.md","Report artifact: relaxation time series scan","unknown"
"report","reports/switching_raw_baseline_correction_report.md","Report artifact: switching raw baseline correction report","background_model"
"report","reports/tau_extracted.md","Report artifact: tau extracted","dip_extraction"
"report","reports/tau_vs_barrier_report.md","Report artifact: tau vs barrier report","dip_extraction"
"report","reports/width_decomposition.md","Report artifact: width decomposition","decomposition"
"report","results/aging/runs/run_2026_03_09_014130_MG119_3sec/reports/geometry_visualization/aging_geometry_report.txt","Report artifact: aging geometry report","unknown"
"report","results/aging/runs/run_2026_03_09_124648_geometry_visualization/reports/geometry_visualization/aging_geometry_report.txt","Report artifact: aging geometry report","unknown"
"report","results/aging/runs/run_2026_03_09_124648_geometry_visualization/reports/geometry_visualization/aging_geometry_review/aging_geometry_report.txt","Report artifact: aging geometry report","unknown"
"report","results/aging/runs/run_2026_03_09_130918_geometry_visualization/reports/geometry_visualization/aging_geometry_report.txt","Report artifact: aging geometry report","unknown"
"report","results/aging/runs/run_2026_03_09_140848_geometry_visualization/reports/geometry_visualization/aging_geometry_report.txt","Report artifact: aging geometry report","unknown"
"report","results/aging/runs/run_2026_03_09_141328_geometry_visualization/reports/geometry_visualization/aging_geometry_report.txt","Report artifact: aging geometry report","unknown"
"report","results/aging/runs/run_2026_03_10_112842_geometry_visualization/reports/aging_geometry_report.txt","Report artifact: aging geometry report","unknown"
"report","results/aging/runs/run_2026_03_10_150549_geometry_visualization/reports/aging_geometry_report.txt","Report artifact: aging geometry report","unknown"
"report","results/aging/runs/run_2026_03_10_171522_observable_mode_correlation/reports/observable_mode_correlation_report.md","Report artifact: observable mode correlation report","decomposition"
"report","results/aging/runs/run_2026_03_10_200643_observable_mode_correlation/reports/observable_mode_correlation_report.md","Report artifact: observable mode correlation report","decomposition"
"report","results/aging/runs/run_2026_03_10_220738_tp_30_structured_export/reports/aging_observable_summary.md","Report artifact: aging observable summary","unknown"
"report","results/aging/runs/run_2026_03_10_223913_tp_6_structured_export/reports/aging_observable_summary.md","Report artifact: aging observable summary","unknown"
"report","results/aging/runs/run_2026_03_10_224229_tp_10_structured_export/reports/aging_observable_summary.md","Report artifact: aging observable summary","unknown"
"report","results/aging/runs/run_2026_03_10_225135_tp_14_structured_export/reports/aging_observable_summary.md","Report artifact: aging observable summary","unknown"
"report","results/aging/runs/run_2026_03_10_225902_tp_18_structured_export/reports/aging_observable_summary.md","Report artifact: aging observable summary","unknown"
"report","results/aging/runs/run_2026_03_10_231114_tp_22_structured_export/reports/aging_observable_summary.md","Report artifact: aging observable summary","unknown"
"report","results/aging/runs/run_2026_03_10_231719_tp_26_structured_export/reports/aging_observable_summary.md","Report artifact: aging observable summary","unknown"
"report","results/aging/runs/run_2026_03_10_232934_tp_34_structured_export/reports/aging_observable_summary.md","Report artifact: aging observable summary","unknown"
"report","results/aging/runs/run_2026_03_10_235137_tp_sweep_summary/reports/aging_tp_sweep_summary.md","Report artifact: aging tp sweep summary","unknown"
"report","results/aging/runs/run_2026_03_11_011643_observable_identification_audit/reports/aging_observable_identification_audit.md","Report artifact: aging observable identification audit","unknown"
"report","results/aging/runs/run_2026_03_11_082451_aging_shape_collapse_analysis/reports/aging_shape_collapse_analysis.md","Report artifact: aging shape collapse analysis","dip_extraction"
"report","results/aging/runs/run_2026_03_12_211204_aging_dataset_build/reports/aging_dataset_build_report.md","Report artifact: aging dataset build report","unknown"
"report","results/aging/runs/run_2026_03_12_223709_aging_timescale_extraction/reports/aging_timescale_extraction_report.md","Report artifact: aging timescale extraction report","dip_extraction"
"report","results/aging/runs/run_2026_03_12_223712_aging_log_time_scaling_test/reports/aging_log_scaling_report.md","Report artifact: aging log scaling report","slope"
"report","results/aging/runs/run_2026_03_12_225842_aging_component_clock_test/reports/aging_component_clock_report.md","Report artifact: aging component clock report","dip_extraction"
"report","results/aging/runs/run_2026_03_12_233710_aging_time_rescaling_collapse/reports/aging_collapse_test_report.md","Report artifact: aging collapse test report","dip_extraction"
"report","results/aging/runs/run_2026_03_13_004253_aging_fm_using_dip_clock/reports/aging_fm_using_dip_clock_report.md","Report artifact: aging fm using dip clock report","dip_extraction"
"report","results/aging/runs/run_2026_03_13_005134_aging_fm_using_dip_clock/reports/aging_fm_using_dip_clock_report.md","Report artifact: aging fm using dip clock report","dip_extraction"
"report","results/aging/runs/run_2026_03_13_010148_aging_fm_using_extracted_dip_tau/reports/fm_extracted_dip_tau_report.md","Report artifact: fm extracted dip tau report","dip_extraction"
"report","results/aging/runs/run_2026_03_13_011143_aging_fm_timescale_analysis/reports/aging_fm_timescale_analysis_report.md","Report artifact: aging fm timescale analysis report","dip_extraction"
"report","results/aging/runs/run_2026_03_13_012211_aging_fm_timescale_analysis/reports/aging_fm_timescale_analysis_report.md","Report artifact: aging fm timescale analysis report","dip_extraction"
"report","results/aging/runs/run_2026_03_13_013634_aging_fm_timescale_analysis/reports/aging_fm_timescale_analysis_report.md","Report artifact: aging fm timescale analysis report","dip_extraction"
"report","results/aging/runs/run_2026_03_14_071151_tri_scaling_test/reports/tri_scaling_test_report.md","Report artifact: tri scaling test report","dip_extraction"
"report","results/aging/runs/run_2026_03_14_071722_tri_scaling_test/reports/tri_scaling_test_report.md","Report artifact: tri scaling test report","dip_extraction"
"report","results/aging/runs/run_2026_03_14_073402_TRI_cross_temperature_test/reports/tri_cross_temperature_test_report.md","Report artifact: tri cross temperature test report","dip_extraction"
"report","results/aging/runs/run_2026_03_14_074613_aging_clock_ratio_analysis/reports/aging_clock_ratio_analysis_report.md","Report artifact: aging clock ratio analysis report","dip_extraction"
"report","results/aging/runs/run_2026_03_14_074701_TRI_clock_consistency_test/reports/tri_clock_consistency_report.md","Report artifact: tri clock consistency report","dip_extraction"
"report","results/aging/runs/run_2026_03_14_075006_TRI_clock_consistency_test/reports/tri_clock_consistency_report.md","Report artifact: tri clock consistency report","dip_extraction"
"report","results/aging/runs/run_2026_03_14_132559_clock_ratio_temperature_support_audit/reports/aging_clock_ratio_temperature_support_audit_report.md","Report artifact: aging clock ratio temperature support audit report","dip_extraction"
"report","results/aging/runs/run_2026_03_14_133454_clock_ratio_temperature_support_audit/reports/aging_clock_ratio_temperature_support_audit_report.md","Report artifact: aging clock ratio temperature support audit report","dip_extraction"
"report","results/aging/runs/run_2026_03_14_152820_clock_ratio_lower_support_audit/reports/aging_clock_ratio_lower_support_audit_report.md","Report artifact: aging clock ratio lower support audit report","dip_extraction"
"report","results/aging/runs/run_2026_03_16_023652_aging_clock_ratio_temperature_scaling/reports/aging_clock_ratio_temperature_scaling_report.md","Report artifact: aging clock ratio temperature scaling report","dip_extraction"
"report","results/aging/runs/run_legacy_debug_runs/reports/20260223_232412/log.txt","Report artifact: log","unknown"
"report","results/aging/runs/run_legacy_debug_runs/reports/20260223_233951/log.txt","Report artifact: log","unknown"
"report","results/aging/runs/run_legacy_debug_runs/reports/20260223_235148/log.txt","Report artifact: log","unknown"
"report","results/aging/runs/run_legacy_debug_runs/reports/20260223_235318/log.txt","Report artifact: log","unknown"
"report","results/aging/runs/run_legacy_debug_runs/reports/20260223_235451/log.txt","Report artifact: log","unknown"
"report","results/aging/runs/run_legacy_debug_runs/reports/20260223_235729/log.txt","Report artifact: log","unknown"
"report","results/aging/runs/run_legacy_debug_runs/reports/20260223_235739/log.txt","Report artifact: log","unknown"
"report","results/aging/runs/run_legacy_debug_runs/reports/20260223_235755/log.txt","Report artifact: log","unknown"
"report","results/aging/runs/run_legacy_debug_runs/reports/20260223_235809/log.txt","Report artifact: log","unknown"
"report","results/aging/runs/run_legacy_debug_runs/reports/20260223_235824/log.txt","Report artifact: log","unknown"
"report","results/aging/runs/run_legacy_debug_runs/reports/20260223_235838/log.txt","Report artifact: log","unknown"
"report","results/aging/runs/run_legacy_debug_runs/reports/20260223_235853/log.txt","Report artifact: log","unknown"
"report","results/aging/runs/run_legacy_debug_runs/reports/20260224_000324/log.txt","Report artifact: log","unknown"
"report","results/aging/runs/run_legacy_debug_runs/reports/20260224_001959/log.txt","Report artifact: log","unknown"
"report","results/aging/runs/run_legacy_debug_runs/reports/20260224_002638/log.txt","Report artifact: log","unknown"
"report","results/aging/runs/run_legacy_debug_runs/reports/20260224_002731/log.txt","Report artifact: log","unknown"
"report","results/aging/runs/run_legacy_debug_runs/reports/20260224_002811/log.txt","Report artifact: log","unknown"
"report","results/aging/runs/run_legacy_debug_runs/reports/20260224_002943/log.txt","Report artifact: log","unknown"
"report","results/aging/runs/run_legacy_debug_runs/reports/20260224_003312/log.txt","Report artifact: log","unknown"
"report","results/aging/runs/run_legacy_debug_runs/reports/20260224_003546/log.txt","Report artifact: log","unknown"
"report","results/aging/runs/run_legacy_debug_runs/reports/20260224_003657/log.txt","Report artifact: log","unknown"
"report","results/aging/runs/run_legacy_debug_runs/reports/20260224_004516/log.txt","Report artifact: log","unknown"
"report","results/aging/runs/run_legacy_debug_runs/reports/20260224_004632/log.txt","Report artifact: log","unknown"
"report","results/aging/runs/run_legacy_debug_runs/reports/20260224_004814/log.txt","Report artifact: log","unknown"
"report","results/aging/runs/run_legacy_debug_runs/reports/20260224_004914/log.txt","Report artifact: log","unknown"
"report","results/aging/runs/run_legacy_debug_runs/reports/20260224_005119/log.txt","Report artifact: log","unknown"
"report","results/aging/runs/run_legacy_debug_runs/reports/20260224_005315/log.txt","Report artifact: log","unknown"
"report","results/aging/runs/run_legacy_debug_runs/reports/20260224_005548/log.txt","Report artifact: log","unknown"
"report","results/aging/runs/run_legacy_debug_runs/reports/20260224_005708/log.txt","Report artifact: log","unknown"
"report","results/aging/runs/run_legacy_debug_runs/reports/20260224_005824/log.txt","Report artifact: log","unknown"
"report","results/aging/runs/run_legacy_debug_runs/reports/20260224_011853/log.txt","Report artifact: log","unknown"
"report","results/aging/runs/run_legacy_debug_runs/reports/20260224_013216/log.txt","Report artifact: log","unknown"
"report","results/aging/runs/run_legacy_debug_runs/reports/20260224_083013/log.txt","Report artifact: log","unknown"
"report","results/aging/runs/run_legacy_debug_runs/reports/20260224_224027/log.txt","Report artifact: log","unknown"
"report","results/aging/runs/run_legacy_debug_runs/reports/20260224_224858/log.txt","Report artifact: log","unknown"
"report","results/aging/runs/run_legacy_debug_runs/reports/20260224_225013/log.txt","Report artifact: log","unknown"
"report","results/aging/runs/run_legacy_debug_runs/reports/20260224_225238/log.txt","Report artifact: log","unknown"
"report","results/aging/runs/run_legacy_debug_runs/reports/20260224_225631/log.txt","Report artifact: log","unknown"
"report","results/aging/runs/run_legacy_debug_runs/reports/20260224_225817/log.txt","Report artifact: log","unknown"
"report","results/aging/runs/run_legacy_debug_runs/reports/20260224_230105/log.txt","Report artifact: log","unknown"
"report","results/aging/runs/run_legacy_debug_runs/reports/20260224_230234/log.txt","Report artifact: log","unknown"
"report","results/aging/runs/run_legacy_debug_runs/reports/20260224_230301/log.txt","Report artifact: log","unknown"
"report","results/aging/runs/run_legacy_debug_runs/reports/20260224_230318/log.txt","Report artifact: log","unknown"
"report","results/aging/runs/run_legacy_debug_runs/reports/20260224_230421/log.txt","Report artifact: log","unknown"
"report","results/aging/runs/run_legacy_debug_runs/reports/20260224_230646/log.txt","Report artifact: log","unknown"
"report","results/aging/runs/run_legacy_debug_runs/reports/20260224_231124/log.txt","Report artifact: log","unknown"
"report","results/aging/runs/run_legacy_debug_runs/reports/20260224_233621/log.txt","Report artifact: log","unknown"
"report","results/aging/runs/run_legacy_debug_runs/reports/20260224_233756/log.txt","Report artifact: log","unknown"
"report","results/aging/runs/run_legacy_debug_runs/reports/20260224_233958/log.txt","Report artifact: log","unknown"
"report","results/aging/runs/run_legacy_debug_runs/reports/20260224_234229/log.txt","Report artifact: log","unknown"
"report","results/aging/runs/run_legacy_debug_runs/reports/20260224_234345/log.txt","Report artifact: log","unknown"
"report","results/aging/runs/run_legacy_debug_runs/reports/20260224_234940/log.txt","Report artifact: log","unknown"
"report","results/aging/runs/run_legacy_debug_runs/reports/20260224_235202/log.txt","Report artifact: log","unknown"
"report","results/aging/runs/run_legacy_debug_runs/reports/20260225_011039/log.txt","Report artifact: log","unknown"
"report","results/aging/runs/run_legacy_debug_runs/reports/20260225_011455/log.txt","Report artifact: log","unknown"
"report","results/aging/runs/run_legacy_debug_runs/reports/20260225_011812/log.txt","Report artifact: log","unknown"
"report","results/aging/runs/run_legacy_debug_runs/reports/20260225_012405/log.txt","Report artifact: log","unknown"
"report","results/aging/runs/run_legacy_debug_runs/reports/20260225_014207/log.txt","Report artifact: log","unknown"
"report","results/aging/runs/run_legacy_debug_runs/reports/20260225_014957/log.txt","Report artifact: log","unknown"
"report","results/aging/runs/run_legacy_debug_runs/reports/20260225_062621/log.txt","Report artifact: log","unknown"
"report","results/aging/runs/run_legacy_debug_runs/reports/20260226_231405/log.txt","Report artifact: log","unknown"
"report","results/aging/runs/run_legacy_debug_runs/reports/20260226_231544/log.txt","Report artifact: log","unknown"
"report","results/aging/runs/run_legacy_debug_runs/reports/20260226_231622/log.txt","Report artifact: log","unknown"
"report","results/aging/runs/run_legacy_debug_runs/reports/20260226_231736/log.txt","Report artifact: log","unknown"
"report","results/aging/runs/run_legacy_debug_runs/reports/20260227_102753/log.txt","Report artifact: log","unknown"
"report","results/aging/runs/run_legacy_debug_runs/reports/20260304_203209/log.txt","Report artifact: log","unknown"
