option_id,option_name,description,affected_artifacts,benefits,risks,requires_code_change,requires_doc_change,requires_new_artifact,recommended_for_F01B,notes
OPT1,Track_identity_CSV_in_git,Add explicit un-ignore for tables/switching_canonical_identity.csv or commit under maintenance-approved path so every clone has identical LOCKED row,.gitignore; clone workflows; CI,"Portable identity anchor; aligns steward agent with dev tree; reduces spurious mtime fallback",Must define update protocol when canonical run changes; may blur generated-vs-hand policy,YES_if_ignore_rule,YES,YES_if_regenerated_else_NO,YES,"Pair with change-control when CANONICAL_RUN_ID updates"
OPT2,Documentation_and_workstream_only,Align project_control_board and project_workstream_status wording on what missing means plus date stamps,docs/project_control_board.md; tables/project_workstream_status.csv,"Fast clarity; no gitignore shock","Does not fix clone without file or resolver divergence alone",NO,YES,NO,YES_as_minimum,"Define missing equals absent from git index vs absent on disk"
OPT3,Resolver_fail_closed_for_canonical_consumers,Tighten switchingResolveLatestCanonicalTable or caller contracts so canonical audits error instead of mtime when identity missing,Switching/utils/switchingResolveLatestCanonicalTable.m; high-level audits,"Prevents silent wrong run id for S_long",Breaks workflows that relied on fallback until identity restored,YES,YES,NO,OPTIONAL,"Needs owner agreement on which callers are strict"
OPT4,Generate_identity_from_registry,Script or maintenance step emits identity CSV from analysis/knowledge/run_registry.csv canonical_identity_anchor row,tools or scripts; tables output,"Single machine-readable anchor source",Introduces generator ownership and drift checks,YES,YES,YES_as_generator_output,OPTIONAL,"Keeps tables/*.csv generated pattern but centralizes logic"
OPT5,Registry_only_resolver_inputs,Change resolver to prefer run_registry anchor without requiring identity file on disk,run_registry.csv; resolver,"Removes dependency on ignored CSV file","Registry not identical to filesystem inventory per control board caution",YES,YES,NO,OPTIONAL,"Must reconcile run_registry.csv caveat lines in project_control_board"
