variable,classification,best_observable_proxies,observable_predictor_candidates,loocv_rmse_best,n_loocv,pearson_best_single_predictor,n_pearson,spearman_best_single_predictor,n_spearman,evidence_sources,notes
P_T,DIRECTLY OBSERVED (PT_backbone object),PT_backbone descriptors (quantile ladder q50/q75/q90; spread90_50; std_threshold; mean/median),spread90_50; tail_width_q90_q50_PT; median_I_mA; PT-backed quantile ladder descriptors,,NaN,NaN,NaN,NaN,`tables/latent_to_observable_replacement_table.csv` (PT_backbone row),Best mapping is descriptor-vector/object-based, not a single scalar
kappa1, WELL MAPPED,upper-threshold PT tail width + map scale,tail_width_q90_q50_PT + S_peak_mA; LOOCV comparison single observable uses `q90_I alone`,0.0184738729675384,12,0.970628407015015,14,NaN,NaN,`tables/observable_replacement_model_tests.csv` (k1_fit_01); `tables/agent24h_correlations.csv` (kappa1 vs S_peak),Joint proxy strongly preferred in LOOCV over the single-observable baseline (`q90_I`)
kappa2, PARTIAL / UNCLEAR,I_peak_mA (ridge peak current),I_peak_mA; comparison: kappa1 + std + q90-q50 barrier mix,0.113456194057352,11,0.481827910038027,14,NaN,NaN,`tables/observable_replacement_model_tests.csv` (k2_fit_01); `tables/agent24h_correlations.csv` (kappa2 vs I_peak_mA),Observable mapping is competitive but not closed; LOOCV proxy error is meaningfully higher than kappa1
Phi1, NOT MAPPED AS A SINGLE NUMERIC PROXY,none (field retained; prose-level substitute only),N/A,N/A,NaN,NaN,NaN,NaN,NaN,`tables/latent_to_observable_replacement_table.csv` (phi1 row); `tables/observable_replacement_model_tests.csv` (S_strip_01 evidence),Do not replace mode field in model; only describe qualitatively in paper language
Phi2, NOT MAPPED AS A SINGLE NUMERIC PROXY,none (kernel/shape metrics retained; prose-level substitute only),phi2 structure metrics / template patterns,NaN,NaN,NaN,NaN,NaN,NaN,`tables/latent_to_observable_replacement_table.csv` (phi2 row),PHI2 stability for replacement is flagged as not reliably single-number; keep field for model retention
