workstream_id,workstream_name,scope,module,phase_ref,canonical_code_status,canonical_run_status,knowledge_integration_status,claims_alignment,snapshot_alignment,context_alignment,query_alignment,primary_blocker,next_action,anchors,status_confidence,do_not_assume,last_updated_utc,updated_by
switching_knowledge_integration,Switching Knowledge Integration,module,Switching,docs/system_master_plan.md,YES,YES,WEAK,LEGACY_WEIGHTED,PARTIAL,YES,NO,"producer `.csv.meta.json` sidecars exist; canonical collapse hierarchy passes metadata gate (used_width_scaling=NO); metrics computed; Phi1/kappa1 sign corrected in hierarchy (3ce1f83); physics interpretation ready per coordination (BACKBONE_SUFFICIENT=NO PHI1_DOMINANT_CORRECTION=YES PHI2_MEANINGFUL_INCREMENT=YES READY_FOR_PHYSICS_INTERPRETATION=YES); remaining blockers: knowledge propagation to claims/snapshot/query still pending; RUNNABLE_SCRIPT_CONTRACT_OK=NO (run_switching_canonical.m uses clearvars not exact clear; clc; run_switching_residual_mode_analysis.m local functions; CHECK_FUNCTION=FAIL)","plan claims/snapshot/query propagation for new collapse metrics and Phi1 sign; fix pure-script contract on Switching runners; continue physics interpretation using hierarchy outputs (coordination summary: rmse_backbone_global~0.063502 rmse_backbone_phi1_global~0.022016 rmse_backbone_phi1_phi2_global~0.011167 fractional_gain_phi1~+0.653 fractional_gain_phi2~+0.493); not all Switching infrastructure clean","tables/switching_canonical_identity.csv;analysis/knowledge/run_registry.csv;docs/repo_state.json;docs/model/repo_state_full_description.json;docs/context_bundle.json;docs/context_bundle_full.json;claims/;snapshot_scientific_v3/;analysis/query/query_system.m;Switching/analysis/run_switching_canonical_collapse_hierarchy.m;Switching/analysis/run_switching_canonical.m;Switching/analysis/run_switching_residual_mode_analysis.m",MEDIUM,"claims/query/snapshot are already current for new collapse metrics and Phi1 sign; runnable-script contract is fully clean across Switching runners",2026-04-25T12:00:00Z,agent
project_coordination_layer,Project Coordination Layer,system,multi_module,docs/system_master_plan.md,UNKNOWN,UNKNOWN,PARTIAL,UNKNOWN,UNKNOWN,UNKNOWN,UNKNOWN,status can drift without disciplined pointer-only updates,maintain concise pointer-only board and strict update protocol,"docs/project_control_board.md;tables/project_workstream_status.csv;docs/AGENT_RULES.md;docs/infrastructure_laws.md",HIGH,this layer is an evidence source or a replacement for existing systems,2026-04-24T16:33:00Z,agent
aging_canonicalization,Aging Canonicalization,module,Aging,docs/system_master_plan.md,YES,UNKNOWN,PARTIAL,UNKNOWN,UNKNOWN,PARTIAL,UNKNOWN,module marked NON_CANONICAL in module status table,track canonical entry and run identity closure before cross-module unlock,"tables/module_canonical_status.csv;docs/system_master_plan.md;docs/system_registry.json",LOW,Aging has canonicalization work pending and is not fully canonical across gates,2026-04-24T19:25:00Z,agent
relaxation_canonicalization,Relaxation Canonicalization,module,Relaxation,docs/system_master_plan.md,YES,UNKNOWN,PARTIAL,UNKNOWN,UNKNOWN,PARTIAL,UNKNOWN,module marked NON_CANONICAL in module status table,track canonical entry and run identity closure before cross-module unlock,"tables/module_canonical_status.csv;docs/system_master_plan.md;docs/system_registry.json",LOW,Relaxation has canonicalization work pending and is not fully canonical across gates,2026-04-24T19:25:00Z,agent
magnetization_pipeline_audit,Magnetization Pipeline Audit,system,multi_module,docs/system_master_plan.md,UNKNOWN,UNKNOWN,UNKNOWN,UNKNOWN,UNKNOWN,UNKNOWN,UNKNOWN,active audit scope and closure criteria are not consolidated in this layer,maintain as audit workstream with explicit anchors and UNKNOWN until proven,"docs/system_master_plan.md;docs/infrastructure_laws.md;analysis/knowledge/run_registry.csv;snapshot_scientific_v3/",LOW,audit outputs imply canonical integration closure by default,2026-04-24T16:33:00Z,agent
