"claim_id","topic","question_answered","interpretation","status","primary_evidence","claim_boundary"
"F01","PT_CDF_backbone","What did canonical_decomposition add beyond PT_CDF_backbone?","canonical_decomposition adds structured residual layers beyond PT_CDF_backbone: first Phi1_canon/kappa1_canon, then Phi2_canon/kappa2_canon, with additional diagnostic Phi3_diag/kappa3_diag.","FINAL_BOUNDED","tables/switching_mode_claim_boundary.csv; tables/switching_rank2_gain.csv; tables/switching_canonical_collapse_hierarchy_status.csv","No full closure claim."
"F02","Phi1_canon","What is the map effect of Phi1_canon?","Phi1_canon map effect is concentrated at high-current/tail-weighted regions and provides the primary first correction to PT_CDF_backbone in canonical_decomposition.","FINAL_BOUNDED","tables/switching_phi1_high_current_localization.csv; tables/switching_phi1_shape_physics.csv; tables/switching_phi1_residual_sign_interpretation.csv","Main-domain weakening interpretation is bounded; 32K exception retained."
"F03","kappa1_canon","What does kappa1_canon measure?","kappa1_canon measures leading amplitude of Phi1_canon contribution with strong canonical coupling to S_peak and additional row-structure response context.","FINAL_BOUNDED","tables/switching_phi1_contrast_dependence.csv; tables/switching_phi1_observable_signatures.csv; tables/switching_canonical_observable_dictionary.csv","Not promoted to full physical state variable."
"F04","Phi2_canon","What is the map effect of Phi2_canon?","Phi2_canon provides material subleading map gain, with strong contribution in transition/high-current tail regions and nonzero main-domain gain.","FINAL_BOUNDED","reports/switching_phi2_map_contribution_audit.md; reports/switching_phi2_physical_meaning_audit.md; reports/switching_phi2_deformation_geometry_audit.md","Subleading component only; not independent full closure."
"F05","kappa2_canon","What does kappa2_canon measure?","kappa2_canon measures subleading residual burden amplitude with mixed tail/asymmetry/amplitude structure after canonical scale controls.","FINAL_BOUNDED","reports/switching_kappa2_physical_observable_audit.md; reports/switching_kappa2_observable_anatomy_audit.md; reports/switching_kappa2_amplitude_scale_sensitivity.md","Mixed interpretation remains; not reducible to single scalar mechanism."
"F06","Phi3_diag_kappa3_diag","Why are Phi3_diag/kappa3_diag diagnostic-only?","Phi3_diag and kappa3_diag remain diagnostic-only because rank-3 contributions are transition-localized/partial and claim-boundary rules block promotion.","FINAL_BOUNDED","tables/switching_mode_hierarchy_status.csv; tables/switching_stage_e5b_claim_boundary_review.csv; reports/rank3_reconstruction_importance_audit.md; reports/rank3_physical_classification.md","No promotion to interpreted physical mode."
"F07","not_claimed","What is still not claimed?","No full cross-experiment mechanism, no full rank-2 closure, no promotion of Phi3_diag/kappa3_diag, and no canonical-safe use of phi2_replacement_audit artifacts.","FINAL_BOUNDARY","tables/switching_mode_claim_boundary.csv; reports/switching_canonical_mode_anatomy_coverage_audit.md","Boundary remains active."
"F08","next_safe_steps","What is now safe to do next?","Safe next actions are canonical replay startup and bounded canonical interpretation writing under current claim boundaries and namespace contract.","READY_NEXT","tables/switching_phi1_kappa1_completion_status.csv; tables/switching_canonical_decomposition_synthesis_status.csv","Replay is a next-step process, not included in this synthesis."
