conceptual_group,main_files,apparent_status,gaps_or_confusions,recommended_followup
canonical generation/decomposition,"Switching/analysis/run_switching_canonical.m; Switching/analysis/run_switching_canonical_collapse_hierarchy.m; tables/switching_canonical_S_long_column_namespace.csv; reports/switching_canonical_namespace_backbone_map.md",ACTIVE_LOCKED_ENTRYPOINT_WITH_MIXED_OUTPUT,"Single producer serves CANON_GEN_SOURCE S vs EXPERIMENTAL_PTCDF_DIAGNOSTIC columns; easy to cite wrong column family",Keep read-first pointers in script headers; use output separation PS1 when refreshing runs
canonical replay,"scripts/run_switching_stabilized_gauge_figure_replay.m; Switching/analysis/run_switching_canonical_first_figure_anchor.m; scripts/run_switching_canonical_paper_figures.ps1; reports/switching_stabilized_gauge_figure_replay.md",ACTIVE_SUBSYSTEM,"Replay family spans gauge stabilized vs canonical map; namespace headers required per script",Maintain explicit replay run_id in reports when adding new replay variants
old/corrected-old reconstruction,"scripts/run_switching_corrected_old_authoritative_builder.ps1; Switching/analysis/run_switching_corrected_old_builder_readiness_check.m; tables/switching_corrected_old_authoritative_artifact_index.csv; reports/switching_corrected_old_authoritative_builder.md",AUTHORITATIVE_PACKAGE_PRESENT,"Many parallel corrected-old QA reports; distinguish authoritative index rows vs quarantined attempts",When adding outputs update authoritative index and builder status tables together
legacy quarantine,"reports/switching_quarantine_index.md; tables/switching_quarantine_index.csv; tables/switching_misleading_or_dangerous_artifacts.csv; docs/switching_analysis_map.md LEGACY_OLD_TEMPLATE section",GOVERNED,"Legacy routes live under results_old and old script names; cross-links easy to miss",Periodic grep for forbidden claims without namespace_id in new docs
X_eff / effective observables,"scripts/run_switching_Xeff_width_validity_atlas.ps1; tables/switching_Xeff_validity_atlas_status.csv; tables/switching_center_width_candidate_inventory.csv; reports/switching_Xeff_width_validity_atlas.md",ACTIVE_AUDIT_TRAIL,"Effective observables gated separately from raw CANON columns",Cross-check locks in corrected-old artifact index when width semantics change
collapse/collapse-failure analysis,"Switching/analysis/run_switching_phase4B_C01_X_like_panel_orientation_lock.m; Switching/analysis/run_switching_phase4B_C02_collapse_like_panel_range_lock.m; Switching/analysis/run_switching_phase4B_C02B_primary_collapse_variant_audit.m; tables/switching_phase4B_*.csv; scripts/run_switching_phase4C_collapse_stress_tests.ps1",ACTIVE_PHASE4_5_ARTIFACTS,"Git status showed deleted figures/switching phase4B assets in working tree",Restore or update figure inventory tables if those PNGs are still referenced
visualization/publication figures,"scripts/run_switching_canonical_X_panel_orientation_repair.m; scripts/run_switching_baseline_X_panel_style_fix.m; figures/switching/ (dir); reports/switching_canonical_paper_figures.md",MIXED,"Figure paths vs tracked git state may diverge",Align figure repair docs with committed binary policy
governance/naming/source-of-truth,"reports/switching_corrected_canonical_current_state.md; docs/switching_analysis_map.md; docs/switching_governance_persistence_manifest.md; docs/decisions/switching_main_narrative_namespace_decision.md; docs/switching_phi1_terminology_contract.md",CONTRACTED,"Deprecated switching_canonical_definition.md still references missing canonical/xy_switching",Either restore xy_switching hub or retarget deprecated pointers to an existing path
validation/status/manifest/fingerprint,"tables/switching_*_status.csv (many); tables/switching_canonical_run_closure.csv; tools/switching_canonical_run_closure.m; reports/switching_infrastructure_closure.md",BROAD_MACHINE_READABLE_LAYER,"No single Switching/validation/ folder; validation scattered across analysis/diagnostics/scripts",Optional thin index markdown linking phase status CSVs to owning scripts
