candidate_id,candidate_name,likely_source_artifacts,expected_outputs,required_QA_figure,semantic_risks,why_it_is_narrow,recommendation_rank
P4A_C01,Single_X_like_panel_replot_orientation_lock,"tables/switching_corrected_old_authoritative_artifact_index.csv; tables/switching_corrected_old_authoritative_builder_status.csv; existing corrected-old authoritative tables","one scoped output table documenting panel input slice; one scope-note report fragment","One X-like PNG panel with explicit orientation, axis limits, and source family tags","X/collapse naming confusion; orientation flip risk; accidental legacy/dynamic mix","Touches one panel family and one bounded input subset only","1"
P4A_C02,Single_collapse_like_panel_replot_range_lock,"corrected-old authoritative collapse-related table subset; switching semantic allowed-use matrix","one collapse-slice table; one traceability side note","One collapse-like PNG panel with declared range lock and display-only transform note","collapse token confusion; range clipping interpreted as physics","Single collapse slice only; no broad replay or recomputation","2"
P4A_C03,Corrected_old_source_identity_table_only,"tables/switching_corrected_old_authoritative_artifact_index.csv; tables/switching_semantic_materialized_artifact_registry.csv","one machine-readable identity table mapping source family and semantic family","None required if purely tabular; optional tiny PNG sanity panel","semantic_family_id drift; canonical vs corrected-old conflation","No replay execution, no figure generation requirement if table-only","3"
P4A_C04,Old_vs_corrected_semantic_comparison_table,"tables/switching_old_to_corrected_canonical_reconstruction_matrix.csv; semantic taxonomy and allowed-use tables","one comparison table with old-family to corrected-family mapping and constraints","Optional small QA PNG if a panel mapping is cited","overstating equivalence between legacy_old and corrected-old authority","Tabular comparison only; no runtime replay path","4"
P4A_C05,Minimal_visual_QA_panel_from_existing_corrected_source,"existing corrected-old authoritative table subset already committed; reconstruction program constraints","one minimal QA panel manifest row and caption text entry","One minimal PNG panel using existing committed corrected source data","display transform mistaken as source-data transform; manuscript overclaim from QA image","Uses existing committed data only, no new replay computation","5"
