task_id,task_name,task_type,depends_on,allowed_now,scope,expected_outputs,must_not_do,notes
PRB_01,Implement versioned pathway registry table (CSV or DB-lite),implementation,This charter + gap survey P002,YES within Aging tables/ only,Add tables/aging/aging_pathway_registry_*.csv keyed by pathway_id,Machine-readable registry + status row; no MATLAB,Change pathway_id strings in existing committed scripts,Implements G002—opaque ids
PRB_02,Implement or audit F7V row-identity bridge emitters,implementation,aging_F7V_required_bridge_contract.csv + row_identity_contract,YES design and doc only for first PR; code later if chartered,MATLAB or export script per bridge_id + validation run report,Bridge long tables + match_quality column,Merge families without family_id,Delivers G001 with tests
PRB_03,Implement tau bundle validator (read-only checker),tooling,PRB_01 + tau_bundle_contract,YES spec or script in tools/ or tables validation only,Validator that checks main CSV + sidecar + manifest,Pass/fail report + row-level flags,Recompute tau values,Implements G003 without execution
PRB_04,Design explicit allowed-comparison matrix for automation,spec,PRB_01 + allowed_comparisons rows,YES,Doc + machine expansion of allowed_comparisons with version id,Versioned comparison matrix CSV,Run comparisons in code,Pre-runner gate
PRB_05,Implement comparison runner,implementation,PRB_01 through PRB_04 + F7T if ratio lane,NO until matrix and validator pass,Future Aging analysis runner,Runner outputs with manifest,Ad-hoc multipath or mix pathways without registry row,ONLY after this charter is committed and tasks 01–04 done
