guardrail_id,forbidden_action,reason,source_policy,consequence_if_violated,allowed_alternative,notes
GR_AFM_DIP_DEPTH_IDENTITY,Treat AFM_like values as interchangeable with Dip_depth in consolidation or ratio numerators.,Different producer semantics and freeze roles.,docs/aging_measurement_definition_freeze.md aging_F7V_forbidden_substitutions.csv,invalid reader contract invalid pairing and invalid multipath narrative,dual-track rows with distinct branch_family and explicit pairing_status FORBIDDEN for substitution,F7V P_DIP_SUMMARY
GR_FM_LIKE_FM_ABS_IDENTITY,Treat FM_like as FM_abs or pipe FM_like through FM_abs tau reader.,Fit summary vs magnitude column identity forbidden.,same freeze F7V,separate tau paths corrupted,separate streams plus chartered Track A tau adapter when curves exist,F7V P_FM_SUMMARY
GR_AREA_TO_DEPTH_SILENT_MAP,Map Dip_area_selected into Dip_depth column without documented bridge row.,Track A fit area not stage4 Dip_depth.,freeze,broken aging_observable_dataset contract,explicit bridge mapping row with lineage and scalar_type BRIDGED,F7V forbidden row
GR_FM_ABS_AS_SIGNED_FM,Use FM_abs alone to claim FM sign reversal direction.,FM_abs drops sign.,freeze plus F7J FM policy,misclaimed reversal,export FM_signed FM_step_mag alongside FM_abs per sign visibility bridge,F7J audit
GR_SUMMARY_AS_TW_CURVE,Treat per-Tp summary scalars as tw-resolved curves without declared reader.,Tau contracts differ.,F7U compatibility,gamma/baseline mismatch export NA grid_type,MARK grid_type PER_TP_SUMMARY_ONLY and block tau until reader,F7V grid risk
GR_DIAGNOSTIC_AS_MODEL_SAFE,Promote DIAGNOSTIC_ONLY pairing to ratio robustness without gate upgrade.,Diagnostics lack substitution charter.,F7W pairing policy,overclaimed robustness,keep diagnostic_only until pairing_status and tau closure change,F7V P_TRACKA_EXPORT_VS_CONSOL
GR_UNPAIRED_MULTIPATH,Execute multipath clock-ratio robustness when tau paths are unpaired or lineage incomplete.,Ratio robustness cannot proceed from incomplete paths.,F7T F7V,misleading clock-ratio ensemble,complete pairing_policy allowed_for_ratio_robustness TRUE both branches,F7V status
GR_TRACK_RENAME,Silently rename Track A columns to Track B names in export long table.,Violates identity preservation.,F7V BRIDGE_LONG_COMPONENT_TABLE must_not_do,dual-track collapse,distinct component_id and branch_family always,F7V bridge contract
