task_order,task_id,task_type,component_scope,purpose,depends_on,can_run_in_parallel_with,must_run_after,expected_outputs,expected_status_flags,forbidden_actions,unlocks
1,AGING-TAU-FIX-01-SHARED-DATASET-LINEAGE,GOVERNANCE_CLOSURE,shared,Close canonical source dataset identity and shared baseline signal lineage for Dip/FM,none,NONE,none,tables/aging/aging_tau_fix_01_shared_dataset_lineage.csv; reports/aging/aging_tau_fix_01_shared_dataset_lineage.md,BASELINE_SIGNAL_LINEAGE_COMPLETE=YES; DATASET_IDENTITY_LOCKED=YES,no MATLAB/Python/Node/replay no tau/refit/ratios no figure generation,Unlocks Dip and FM branch-specific closure tasks
2,AGING-TAU-FIX-02-DIP-COMPONENT-BRANCH,GOVERNANCE_CLOSURE,Dip,Close Dip branch and component-definition lineage and bind Dip tau method to canonical branch token,AGING-TAU-FIX-01-SHARED-DATASET-LINEAGE,NONE,AGING-TAU-FIX-01-SHARED-DATASET-LINEAGE,tables/aging/aging_tau_fix_02_dip_branch_closure.csv; reports/aging/aging_tau_fix_02_dip_branch_closure.md,DIP_BRANCH_LINEAGE_COMPLETE=YES; DIP_TAU_METHOD_BOUND=YES,no recomputation or refit of Dip tau no pipeline edits,Unlocks sidecar hardening and readiness gate for Dip
3,AGING-TAU-FIX-03-FM-COMPONENT-BRANCH,GOVERNANCE_CLOSURE,FM,Close FM component convention and branch lineage including signed-source and ABS policy closure,AGING-TAU-FIX-01-SHARED-DATASET-LINEAGE,NONE,AGING-TAU-FIX-01-SHARED-DATASET-LINEAGE,tables/aging/aging_tau_fix_03_fm_branch_closure.csv; reports/aging/aging_tau_fix_03_fm_branch_closure.md,FM_BRANCH_LINEAGE_COMPLETE=YES; FM_CONVENTION_CLOSED=YES,no FM tau recomputation no replay no ratio execution,Unlocks sidecar hardening and readiness gate for FM
4,AGING-TAU-FIX-04-SIDECAR-HARDENING,GOVERNANCE_CLOSURE,shared,Promote Dip/FM sidecar lineage tokens and naming guards to canonical-complete metadata contract,AGING-TAU-FIX-02-DIP-COMPONENT-BRANCH|AGING-TAU-FIX-03-FM-COMPONENT-BRANCH,NONE,AGING-TAU-FIX-02-DIP-COMPONENT-BRANCH|AGING-TAU-FIX-03-FM-COMPONENT-BRANCH,tables/aging/aging_tau_fix_04_sidecar_hardening.csv; reports/aging/aging_tau_fix_04_sidecar_hardening.md,SIDECAR_LINEAGE_COMPLETE=YES; NAMING_GUARDS_ENFORCED=YES,no new tau computation no table synthesis from reruns,Unlocks row identity/co-registration finalization
5,AGING-TAU-FIX-05-ROW-IDENTITY-COREGISTRATION,GOVERNANCE_CLOSURE,shared,Close row identity UID layer and co-registration eligibility semantics for baseline Dip/FM comparison lane,AGING-TAU-FIX-04-SIDECAR-HARDENING,NONE,AGING-TAU-FIX-04-SIDECAR-HARDENING,tables/aging/aging_tau_fix_05_row_identity_coreg.csv; reports/aging/aging_tau_fix_05_row_identity_coreg.md,ROW_IDENTITY_VALIDATED_FULLY=YES; BASELINE_ROWS_COMPARISON_ELIGIBLE=YES,no comparison runner execution no ratios,Unlocks canonical readiness gate audit
6,AGING-TAU-FIX-06-CANONICAL-READINESS-GATE,AUDIT_GATE,shared,Audit-only final gate for Dip/FM canonical readiness using existing artifacts without recomputation,AGING-TAU-FIX-05-ROW-IDENTITY-COREGISTRATION,NONE,AGING-TAU-FIX-05-ROW-IDENTITY-COREGISTRATION,reports/aging/aging_tau_fix_06_canonical_readiness_gate.md; tables/aging/aging_tau_fix_06_canonical_readiness_gate_status.csv,DIP_TAU_CANONICAL_READY=YES or PARTIAL; FM_TAU_CANONICAL_READY=YES or PARTIAL; TAU_SET_READY verdict,no canonicalization by rerun no replay no ratio run no comparison runner run,Defines whether baseline tau can be treated as canonical evidence
