evidence_id,evidence_type,promoted_fact,evidence_value,source_fix01_or_fix01b_artifact,source_row_or_field,supports_shared_dataset_identity,supports_source_dataset_id,supports_source_run_token,supports_required_columns,supports_dip_fm_shared_upstream,canonical_evidence_status,limitation
F01C-E01,PRB03_SHARED_SOURCE_DATASET_ID,Baseline Dip and FM inventory rows reference one shared source_dataset_id path,c:/Dev/matlab-functions/tables/aging/aging_observable_dataset.csv,tables/aging/aging_tau_fix01_shared_dataset_lineage_evidence.csv|E01,PRB03 TB_INV_BL_DIP_TP14 and TB_INV_BL_FM_TP14 columns source_dataset_id,YES,YES,NO,NO,YES,COMMITTED_ANCHOR_PRB03,Path string is metadata in git; file body may be ignored locally
F01C-E02,PRB03_SHARED_SOURCE_RUN,PRB03 lists one shared source_run summary token for Dip and FM baseline rows,"aggregate_structured_export_aging_Tp_tw_2026_04_26_085033|MG119|MG119_3sec | aggregate_structured_export_aging_Tp_tw_2026_04_26_085033|MG119|MG119_36sec",tables/aging/aging_tau_fix01_shared_dataset_lineage_evidence.csv|E02,PRB03 TB_INV_BL_DIP_TP14 source_run (matches TB_INV_BL_FM_TP14),YES,NO,YES,NO,YES,COMMITTED_ANCHOR_PRB03,Token is summarized text not a single filesystem path
F01C-E03,PRB03_DISTINCT_OUTPUT_ARTIFACTS_SAME_LINEAGE,Dip tau artifact path differs from FM tau artifact path while source_dataset_id matches,c:/Dev/matlab-functions/results/aging/runs/run_2026_05_04_134220_aging_timescale_extraction/tables/tau_vs_Tp.csv vs c:/Dev/matlab-functions/results/aging/runs/run_2026_05_04_135134_aging_fm_timescale_analysis/tables/tau_FM_vs_Tp.csv,tables/aging/aging_tau_fix01_shared_dataset_lineage_evidence.csv|E03,PRB03 TB_INV_BL_DIP_TP14 source_artifact; TB_INV_BL_FM_TP14 source_artifact,YES,NO,NO,NO,YES,COMMITTED_ANCHOR_PRB03,Run-local paths not committed; lineage claim uses metadata columns only
F01C-E04,PRB02B_LEDGER_SHARED_DATASET_ID,Bridge ledger pairs Dip and FM rows at the same Tp with identical source_dataset_id and source_run,c:/Dev/matlab-functions/tables/aging/aging_observable_dataset.csv,tables/aging/aging_tau_fix01_shared_dataset_lineage_evidence.csv|E04,PRB02B BL_DIP_TP14 and BL_FM_TP14 columns source_dataset_id and source_run,YES,YES,YES,NO,YES,COMMITTED_ANCHOR_PRB02B,
F01C-E05,CONSOLIDATION_HEADER_COLUMNS,Five-column consolidation carries Tp tw Dip_depth FM_abs source_run,"Tp,tw,Dip_depth,FM_abs,source_run",tables/aging/aging_tau_fix01_shared_dataset_lineage_evidence.csv|E05,F01 evidence E05; FIX-01C promotes header list into committed table,YES,YES,YES,YES,YES,COMMITTED_PROMOTED_EXTRACT_FIX01C,Original header observation referenced local ignored CSV; this row commits the column claim in-repo
F01C-E06,PRB01_REGISTRY_SHARED_OBJECT,Registry defines Stage4 structured export five-column consolidation semantics for baseline pathways,Stage4->structured export->five-column consolidation reader,tables/aging/aging_tau_fix01_shared_dataset_lineage_evidence.csv|E06,PRB01 pathway registry decomposition_method field for baseline rows,YES,NO,NO,NO,YES,COMMITTED_ANCHOR_PRB01,
F01C-E07,PRB02B_INPUT_SOURCES_DATASET,Input-sources table marks consolidation dataset path used with portability caveat,c:/Dev/matlab-functions/tables/aging/aging_observable_dataset.csv,tables/aging/aging_tau_fix01_shared_dataset_lineage_evidence.csv|E07,PRB02B Consolidation_dataset row,YES,YES,NO,NO,YES,COMMITTED_ANCHOR_PRB02B_INPUT,Documents environment/path caveat for on-disk CSV
F01C-E08,PATH_AUDIT_P01,Consolidation dataset path exists locally but file not git-tracked as bulk artifact,P01 UNTRACKED per path audit,tables/aging/aging_tau_fix01_shared_dataset_lineage_path_audit.csv|P01,path_string role Shared baseline Dip/FM input dataset,NO,YES,NO,NO,NO,COMMITTED_METADATA_FIX01,Does not negate committed metadata identity in PRB tables
