slice_id,slice_name,agent_type,depends_on,can_run_now,requires_matlab,requires_python,risk_level,expected_outputs,why_this_slice,why_not_first,recommended_rank
TAU_METADATA_COMPLETION,Tau metadata bundle enforcement for writers and consumers,inventory plus writer patch list,B-003 tau_effective dual-builder disclosure,YES,YES,NO,MEDIUM,row-level metadata checklist pass on tau CSVs,unblocks tau display and ratio readiness without misread,needs writer coordination policy before MATLAB touches wide surfaces,2
TRACKB_READER_VALIDATION,Track B five-column reader smoke and lineage pointer audit,consolidation reader validation,aging_observable_dataset pointer F7D freeze,YES,YES,NO,LOW,execution_status style log plus lineage table,thinnest gated path to tau dip ingest,F7X5 B-003 still affects tau_effective column semantics downstream,1
DIRECT_DECOMPOSITION_CANONICAL_REPLAY,Stage4 direct family canonical replay for dM signed sharp dip,MATLAB runner,replay manifest stage4 cfg logging,YES,YES,NO,MEDIUM,parity tables for pauseRun decomposition fields,grounds pause-run decomposition claims in reproducible runs,heavier than thin reader smoke,3
R_AGE_RATIO_REENTRY,R_age ratio re-entry after tau pairing manifest,analysis runner,prior tau_vs_Tp tau_FM_vs_Tp lineage gated,YES,YES,NO,HIGH,ratio table plus pairing manifest CSV,science slice using downstream combinator,tau metadata and bridge lineage should be verified first B-003 B-004,4
STAGE5_STAGE6_INTERFACE_AUDIT,Stage5 interface versus stage6 summary lineage audit,documentation audit,B-002 PARTIAL callee stage6 upstream mapping,PARTIAL,NO,NO,LOW,matrix of interface fields to summary consumers,disambiguates Track A summaries,does not alone fix tau CSV writers,5
TAU_FM_SIGN_GAP,Tau FM branch sign-blind ingest limitation inventory,method inventory,F7X7 guide FM_abs tau path,YES,NO,NO,LOW,explicit limitation note for FM tau curves,closes FM tau interpretation caveat,lower leverage than metadata bundle enforcement,6
