prerequisite_item,current_status,required_before_R_age,reason,blocking_severity,recommended_next_step
tau_FM_lineage_closed_or_explicitly_scoped,UNRESOLVED_ON_COMMITTED_METADATA,P_INPUT_MANIFEST_OR_LINEAGE_CLOSURE,R_age must not silently inherit NO_UNLESS_LINEAGE_RESOLVED tau_FM lineage,HIGH,F7Q lineage execution audit then ratio charter
clock_ratio_writer_inputs_bound_to_branch_aligned_triples,F7O_VERIFIED_RUNS_EXIST_BUT_NOT_RATIO_WRITER,P_EXPLICIT_CFG_MANIFEST_PER_RATIO_RUN,Prevents cross-branch numerator denominator mixing,HIGH,Define ratio runner cfg template referencing one branch triple
FM_tau_metadata_on_inputs_matches_consumer_contract,F7G_COLUMNS_VERIFIED_ON_F7O_OUTPUTS,P_VERIFY_RATIO_WRITER_READS_SAME_COLUMNS,Risk of stale column names or flags,MEDIUM,Ratio metadata verification task after lineage scope
failed_dip_clock_auxiliary_lineage_for_ratios,SHARED_ARCHIVAL_OPTIONAL_REGEN_PER_OPEN_ITEM,P_DECIDE_STRICT_VS_DOCUMENTED_AUX,Ratios may inherit auxiliary ambiguity if collapse metrics enter ratio,MEDIUM,Decide strict regeneration policy before ratio publishing
canonical_dataset_single_stream_for_published_R_age,NO_DUAL_BRANCH_REMAINS,YES_IF_PUBLISHING_SINGLE_NUMBER,Ratios across branches need explicit policy,HIGH,Keep branch-scoped ratios or complete canonical policy elsewhere (not F7P)
F7O_series_closure_scope,METADATA_ONLY_CLOSED,DO_NOT_TREAT_AS_LINEAGE_CLOSED,F7O explicitly excludes R_age verification,HIGH,Cite aging_F7O_fm_tau_metadata_series_closure.md section 5
