misreading_id,incorrect_interpretation,correct_interpretation,why_it_matters,relevant_rule_or_basis,user_facing_warning,notes
MR-001,Track A or Track B names a physical quantity by itself.,They are router lane labels; pair with concrete objects like AFM_like FM_like Dip_depth and stage.,Mis-labeling collapses incompatible pipelines into one story.,F7X5 R-TRK-001 F7X7 cheatsheet Track row,"Say which objects and which stage -- Track A or B alone is not enough.",From router governance narrative
MR-002,Bridge components like C_DIP_DEPTH_B are default canonical observables.,They are bridge/export alignment rows for pairing and audits not standalone physics tokens.,Wrong substitution breaks cross-branch pairing gates.,F7X5 R-BRI-001,"Tag bridge/export and branch family; do not headline physics from bridge id alone.",F7W F7X bridge charter subtext
MR-003,FM_abs carries signed FM information.,FM_abs is magnitude abs(FM_signed); sign is removed.,Sign reversal narratives cannot be read from FM_abs.,F7X5 R-FM-002,"If you need sign use FM_signed FM_step_mag matrix export or audits per router.",Five-column lane has FM_abs only
MR-004,FM_step_mag is always magnitude-only because of mag in the name.,Wide structured export treats FM_step_mag as signed plateau raw per measurement freeze; verify route and export policy.,Misreading reverses sign diagnostics.,F7X5 R-FM-003 aging_measurement_definition_freeze,"Do not infer magnitude-only from mag substring alone check export policy.",Router FM sign visibility matrix
MR-005,tau_effective_seconds can be read like any seconds column.,Legacy column requires tau_domain tau_method producer grain units methods disclosure; dual builder contexts share name.,Silent comparison across incompatible tau summaries.,F7X5 R-TAU-002 B-003,"Never plot tau_effective_seconds without the tau metadata bundle.",F7X4 tau builders narrative
MR-006,R_age style ratios are measured directly from raw traces like DeltaM.,Ratios combine prior tau CSV outputs lineage gated not pauseRun decomposition scalars.,Misallocation of uncertainty and dataset roles.,F7X5 R-RAT-001,"Say which tau files and columns fed the ratio.",clock_ratio scripts downstream only
MR-007,"Background baseline residual are universal words meaning one thing.",Each maps to distinct contract constructions smooth vs fit plateau vs derivative median vs sharp vs signed dip.,Mixing definitions corrupts comparisons.,F7X5 R-BG-001 R-BG-004,"Replace vague words with stage plus identity token.",F7X4 background tables
MR-008,cfg agingMetricMode fit means Gaussian stage5 fit outputs.,Contract labels that flag stage4 direct-family entry analyzeAFM_FM_components not stage5 outputs.,Misroutes readers to wrong formulas.,F7X5 R-FIT-001 R-DIR-001,"Direct-family fit flag is not stage5 Gaussian fit object.",stage4 switch vs stage5 order
